[
  {
    "category": "core",
    "description_md": "**Primary Goal: Deliver technology solutions that balance cost, speed, and quality to achieve organizational objectives.**\n\n \n\nThe Engineering Persona architects, builds, runs, and supports the technology services that allow organizations to deliver value digitally and intelligently. FinOps provides Engineering teams normalized cost and usage data, which they can use to make decisions about architectures, technology categories, service use, and operations, similarly to how they may use other performance metrics related to resilience or availability. Engineering considers the efficient design and use of resources as they architect, design, and build IT systems. They also are responsible for their use of technology, and perform activities like selecting appropriate resource locations, rightsizing usage to match workloads to resources used, workload management to only run resources when needed, removing unused resources, and monitoring for spending anomalies.\n\n \n\nThe Engineering Persona can be very broad, incorporating roles that include enterprise and application architects, engineering leads, programmers, developers, SREs, DevOps team members, software engineers, systems engineers, service delivery, engineering managers, platform engineering, and other infrastructure and operations team members. \n\n \n\nIt is important to note also that anyone who is developing and delivering technology solutions is considered in the Engineering persona. Modern technology platforms, including AI, can enable system development by non-technical people, but those people must fulfill the responsibilities of the Engineering Persona when acting in this role. \n\n  \n\n#### Objectives\n\n \n\n- Deliver performant and cost effective technology solutions in the right places as quickly as needed.\n- Make cost-aware decisions as early in the build process as possible\n- Develop cost-effective application / service patterns to standardize over time\n- Identify and respond to anomalous spending in technology environments under my control\n- Work closely with FinOps, Product, and Leadership to understand technology constraints that will drive decision making\n- Use technology effectively in ways that support clear allocation of cost and reduce waste\n  \n\n#### Challenges\n\n \n\n- Dynamic and fast changing technology landscape is challenging to manage\n- Mismatch of incentives to develop quickly, add features, and optimize at once\n- Lack of visibility to the cost of various technology choices or usage, particularly for consumption-based services like cloud or AI\n- Difficult to identify service or application ownership\n- Cannot predict the costs closely enough for developing new features and products.\n  \n\n#### Key Metrics\n\n \n\n- Revenue per unit of infrastructure costs\n- Cost per deployed service\n- Service utilization rates\n- Showback & Chargeback of IT costs to the business\n  \n\n#### FinOps Benefits\n\n \n\n- Increased visibility to technology cost closer to real time\n- Connection to the value component of unit economics\n- Centralized FinOps function shares responsibility for purchasing and discounting components of cost\n- Incentive towards solid architecture principles to factor efficiency\n  \n\n#### FinOps Engineering Persona typical roles:\n\n \n\n- **Software Engineer/DevOps Engineer**\n Engineers often have insights into application architecture and resource consumption, which is crucial for FinOps optimization. DevOps engineers, in particular, are often close to the variable costs inherent in platform and cloud infrastructure.\n- **Application Architect / Solutions Architect**\n Architects have a strong understanding of service options, their costs, and tradeoffs. Architects involved in FinOps can drive cost-effectiveness earlier in the development process, and create well known patterns and automation that aide in reducing waste later.\n- **Data Architect / Data Owner\n **Architects, designs, and operates data infrastructure for organizations. A common data infrastructure can support a more effective FinOps practice, as well as being critically important for internal data analysis, and AI initiatives.\n- **Enterprise Architect\n **Develops long-term IT roadmaps, setting enterprise standards, and managing architecture governance.\n- **Systems Administrator / Engineer**\n Sysadmins often have deep knowledge of cloud infrastructure and cost drivers, which is valuable in FinOps.\n- **Software Architect**\n Designs the overall structure and architecture of software systems, ensuring scalability, performance, and maintainability.\n- **DevOps Engineer**\n Bridges the gap between development and operations, automating deployments, managing infrastructure, and ensuring smooth releases.\n- **Data Engineer**\n Builds and maintains the infrastructure for collecting, storing, and processing large datasets.\n- ****AI Engineer\n ****Designs, builds, and deploys AI models and systems.\n- **Data Scientist**\n Extracts knowledge and insights from data to help organizations make informed decisions and solve complex problems.\n- **Systems Engineer**\n Designs, implements, and manages complex systems, often involving hardware and software integration.",
    "license": "CC-BY-4.0",
    "slug": "engineering",
    "source_url": "https://www.finops.org/framework/persona/engineering/",
    "title": "Engineering"
  },
  {
    "category": "core",
    "description_md": "**Primary Goal: Accurately budget, forecast, and report technology costs.**\n\n \n\nFinance teams work closely with FinOps practitioners to understand technology cost data so that they can support accurate forecasting models, financial plans and budgets. Finance will also be a key participant in FinOps reporting, showback, chargeback, commitment purchasing, and invoice management with technology vendors\n\n \n\nFinance roles typically report to an organization’s CFO, including Corporate Finance, Strategic Planners, Financial Analysts (F&PA), Budget Analysts, Financial Business Managers / Advisors, General Ledger, and Accounting. In some organizations, the Finance Persona may also include IT Financial Management (ITFM) duties if they are the primary Finance persona working with Engineering teams, or they may be represented by an ITFM Persona who reports to the CIO or CTO in larger organizations.\n\n  \n\n#### Objectives\n\n \n\n- Clearly quantified value from technology spend\n- Effective Budget Management\n- Accurate technology forecasts\n- Accurate and clear categorization of costs and trends\n- Normalized spend predictability\n- Consistent financial reporting across all technology categories\n  \n\n#### Challenges\n\n \n\n- Increasing percentage of technology spend is consumption-based and less predictable\n- Lack of consistency in how different technology categories report and allocate costs\n- Challenges with legacy finance models (cap-ex vs op-ex)\n- Loss of control when technology procurement and use is distributed and unlimited by capital expenditures\n  \n\n#### Key Metrics\n\n \n\n- Revenue Performance\n- Product Margins\n- COGS (Cost of Goods Sold)\n- Unit Cost Economics\n- Budget and forecast transparency and accuracy\n- Policy and regulatory compliance\n  \n\n#### FinOps Benefits\n\n \n\n- Categorize costs consistently and identify unallocated spend\n- Facilitate showback/chargebacks to increase financial accountability\n- Drive budget and forecast accuracy\n- Guide team to make good technology investments and tradeoffs between technology categories\n  \n\n#### FinOps Finance Persona typical roles:\n\n \n\n- **Finance Analyst / Business Analyst**\n These roles bring analytical skills and financial acumen, essential for FinOps. They understand budgeting, forecasting, and reporting. Often referred to as FP&A.\n- **IT Financial Management (ITFM) Analyst/Manager**\n In organizations where there is not a separate ITFM function reporting to the CIO, the ITFM role will be filled by the Finance Persona. ITFM professionals are already concerned with the gathering, categorizing and analysis of IT costs for accounting and Total Cost of Ownership (TCO)/Return on Investment (ROI) analyses, making FinOps a close adjacent field.",
    "license": "CC-BY-4.0",
    "slug": "finance",
    "source_url": "https://www.finops.org/framework/persona/finance/",
    "title": "Finance"
  },
  {
    "category": "core",